{
  "$schema": "https://json-schema.org/draft/2020-12/schema",
  "$id": "https://jlaudio.github.io/jl-mixing/api/v1.0/schemas/operations/client-update.schema.json",
  "type": "object",
  "additionalProperties": true,
  "required": ["api_version", "operation", "status", "data", "warnings", "errors"],
  "properties": {
    "api_version": {"const": "1.0"},
    "operation": {"const": "client.update"},
    "status": {"enum": ["success", "planned", "blocked", "error"]},
    "data": {
      "type": "object",
      "additionalProperties": true,
      "properties": {
        "client": {
          "type": "object",
          "required": ["id", "path", "configuration_path"],
          "properties": {
            "id": {"type": "string"},
            "path": {"type": "string", "minLength": 1},
            "configuration_path": {"type": "string", "minLength": 1}
          }
        },
        "workspace_path": {"type": "string", "minLength": 1},
        "changed_fields": {"type": "array", "items": {"type": "string"}, "uniqueItems": true},
        "editable": {"type": "object"},
        "last_modified_at": {"type": "string"},
        "changed": {"type": "boolean"},
        "would_update": {"type": "array", "items": {"type": "string", "minLength": 1}}
      }
    },
    "warnings": {"type": "array"},
    "errors": {"type": "array"}
  }
}
