{
  "api_version":"1.0","operation":"client.update","status":"success",
  "data":{"client":{"id":"client-one","path":"/workspace/Clients/Client One","configuration_path":"/workspace/Clients/Client One/client.json"},"workspace_path":"/workspace","changed_fields":["client_name"],"editable":{"client_name":"Client One Updated","artist":"Artist","audio":{"sample_rate":48000,"bit_depth":24,"file_format":"WAV"},"delivery":{"method":"Cloud transfer","requested_deliverables":["main_mix"]}},"last_modified_at":"2030-01-01T13:00:00Z","changed":true},
  "warnings":[],"errors":[]
}
